{
  "schema_version": "clawdia-artifact/v1",
  "id": "review-method-framework",
  "label": "Review method framework",
  "description": "Synthetic reference framework for organizing source reviews.",
  "kind": "framework",
  "delivery_mode": "reference",
  "status": "approved",
  "version": "1.0.0",
  "provides": ["source-review"],
  "requires": {
    "capabilities": [],
    "artifacts": [],
    "runtime_features": []
  },
  "conflicts": {
    "capabilities": [],
    "artifacts": []
  },
  "runtime_compatibility": [
    {"runtime": "hermes", "min_version": "1.0.0"}
  ],
  "risk_level": "low",
  "requires_approval": false
}
