{
  "schema_version": "clawdia-artifact/v1",
  "id": "summary-draft-template",
  "label": "Summary draft template",
  "description": "Synthetic installable template for a traceable review summary.",
  "kind": "template",
  "delivery_mode": "installable",
  "status": "candidate",
  "version": "1.0.0-rc.1",
  "provides": ["source-review"],
  "requires": {
    "capabilities": [],
    "artifacts": [],
    "runtime_features": []
  },
  "conflicts": {
    "capabilities": [],
    "artifacts": []
  },
  "runtime_compatibility": [
    {"runtime": "hermes", "min_version": "1.0.0"}
  ],
  "risk_level": "low",
  "requires_approval": false
}
